{"admission":"ORDINARY_BOUNDED","allow_active_work_to_reach_custody":true,"allow_new_expensive_work":true,"allow_new_speculative_work":false,"decision_at":"2026-08-29T16:00:08Z","decision_digest":"sha256:87fd1d4529c81b0d35f5c58ac3cd84f5705371cbb785e35d2e4be01d43b4b4be","observation_digest":"sha256:6d9559200b3dc1c8c38cad104913dcea9bc6a2f54db0b8422143a9a7d125eb27","policy_digest":"sha256:7567588f6fe319430e5d83e5955c7c20ded2dcb8e5554676db9a1a6482305cb0","provider_id":"provider:fixture","reason_codes":["MINIMUM_REMAINING_WINDOW_NORMAL"],"schema":"nightshift.provider-capacity-decision/v1","state":"NORMAL"}