{"admission":"ORDINARY_BOUNDED","allow_active_work_to_reach_custody":true,"allow_new_expensive_work":true,"allow_new_speculative_work":true,"decision_at":"2026-08-29T16:00:11Z","decision_digest":"sha256:fe4cb7c2aa6196b6b8061940a7808437189af919722da3a1571279c645236f38","observation_digest":"sha256:3095490132428f347fc971e05fc70b8470ea56e366aa644bfc153fe572450e32","policy_digest":"sha256:7567588f6fe319430e5d83e5955c7c20ded2dcb8e5554676db9a1a6482305cb0","provider_id":"provider:fixture","reason_codes":["MINIMUM_REMAINING_WINDOW_ABUNDANT"],"schema":"nightshift.provider-capacity-decision/v1","state":"ABUNDANT"}