{"admission":"ORDINARY_BOUNDED","allow_active_work_to_reach_custody":true,"allow_new_expensive_work":true,"allow_new_speculative_work":true,"decision_at":"2026-08-29T16:00:01Z","decision_digest":"sha256:b753f8be7340026924ce8c9307754eb5d42b0371613e6daf340367b1ffa227aa","observation_digest":"sha256:6ad0d814e1b4fc1f4415b80ff2d22ffe2e0d8c12c3182c6bd361c223d12c4c8e","policy_digest":"sha256:7567588f6fe319430e5d83e5955c7c20ded2dcb8e5554676db9a1a6482305cb0","provider_id":"provider:fixture","reason_codes":["MINIMUM_REMAINING_WINDOW_ABUNDANT"],"schema":"nightshift.provider-capacity-decision/v1","state":"ABUNDANT"}