{"admission":"ORDINARY_BOUNDED","allow_active_work_to_reach_custody":true,"allow_new_expensive_work":true,"allow_new_speculative_work":true,"decision_at":"2026-08-29T16:00:02Z","decision_digest":"sha256:b1cfb45a8e1124d9b9f009b5868a240c3b1d6b2aa51c828adaf4fc22eca94bce","observation_digest":"sha256:6d01d4c5ee08d3c0cbfb1bbda7a838efd449f733f7a1afe57a8cf30ebd794969","policy_digest":"sha256:7567588f6fe319430e5d83e5955c7c20ded2dcb8e5554676db9a1a6482305cb0","provider_id":"provider:fixture","reason_codes":["MINIMUM_REMAINING_WINDOW_ABUNDANT"],"schema":"nightshift.provider-capacity-decision/v1","state":"ABUNDANT"}